Judul,Konten
"Hasil Musra Relawan Jokowi di Jogja: Capres Prabowo, Cawapres Mahfud",Musra relawan Jokowi XVI selesai digelar di Jogja. Hasilnya Prabowo Subianto menjadi calon presiden favorit berdasarkan pemilih Musra Jogja.
Hasil Musra Jokowi di Jogja: Prabowo Capres-Mahfud Md Cawapres,Prabowo dan Mahfud Md menempati posisi puncak dalam Gelaran Musyawarah Rakyat (Musra) Indonesia relawan Joko Widodo (Jokowi) XVI di Jogja.
Canda Ridwan Kamil Ungkap Alasan Gabung Golkar: Golongan Kang Ridwan,"Gubenur Jawa Barat Ridwan Kamil resmi gabung dengan Partai Golkar. Selain alasan politik jelang Pemilu 2024, ternyata Ridwan Kamil pilih Golkar karena namanya."
"Selain Politik, Ternyata Ini Alasan Ridwan Kamil Gabung Golkar",Ridwan Kamil berkelakar soal alasannya gabung ke Partai Golkar. Dia menyebut Golkar singkatan dari Golongan Ridwan Kamil.
Pilu Petani Milenial Jabar: Panen Tak Dibayar dan Dikejar Utang,Kisah pilu dialami warga yang mengikuti program Petani Milenial di Jabar. Ia menceritakan hasil panennya tak dibayar hingga kini dikejar utang.
"Kawasan Industri di Cikarang Menggeliat, Bagaimana Peluang Bisnisnya?",Kawasan industri terus menunjukan situasi yang semakin baik dan ini sesuai dengan riset yang dilakukan perusahaan konsultan properti JLL Indonesia.
"Ridwan Kamil Puji Bobby Benahi Kesawan Medan: Kalau Jadi, Kayak Malioboro","Ridwan Kamil memuji langkah Walkot Bobby Nasution yang menata kawasan Kesawan Medan. Menurutnya jika penataan berhasil, Kesawan bakal seperti Malioboro, Yogya."
Ridwan Kamil: Saya Penasaran Kenapa Tak Ada Lontong Medan di Bandung,"Gubernur Jawa Barat Ridwan Kamil (RK) mengaku penasaran, kenapa lontong Medan tak ada di Bandung. Ia menikmati makanan khas Medan itu."
Atalia dan Bayang-bayang Ridwan Kamil Menatap Pilkada 2024,"Atalia Praratya, istri Gubernur Jabar Ridwan Kamil mulai menunjukkan ketertarikan untuk terjun ke politik. Dia bahkan mengaku direstui sang suami maju Pilkada."
Reaksi PDIP soal Atalia Praratya di Pilwalkot Bandung,Atalia Praratya mendapat restu dari Ridwan Kamil untuk maju di Pilwalkot Bandung. PDIP pun memberikan reaksinya menanggapi hal tersebut.
Ridwan Kamil Ngaku Gaet Rian Ernest Masuk Golkar,Waketum DPP Partai Golkar Ridwan Kamil mengklaim menggaet Rian Ernest masuk Golkar.
Ridwan Kamil Puji Bobby: Medan Beruntung Walkotnya Masih Muda,RK memuji Wali Kota Bobby Nasution saat berkunjung ke Medan. Medan disebut beruntung karena Walkotnya masih muda.
"Naik Bemo Midget, Ijeck Sopiri Ridwan Kamil Berburu Kuliner di Medan",Ijeck membawa Ridwan Kamil berburu kuliner di Medan. Keduanya pergi dengan menggunakan Bemo Widget dengan Ijeck sebagai sopirnya.
Jabar Hari Ini: Puluhan Bayi di RS Bandung Kiwari Dievakuasi,Berikut lima pilihan peristiwa di Jabar Hari Ini yang membetot perhatian publik pilihan tim detikJabar.
Ridwan Kamil Klaim Gaet Rian Ernest Gabung ke Golkar,Ridwan Kamil mengklaim gabungnya Rian Ernest ke Golkar karena dirinya. Dia berharap ke depan semakin banyak anak muda yang gabung ke Golkar.
Asa Menjadikan Observatorium Bosscha Pusat Studi Ilmu Multidisiplin,Rektor ITB Reini Djuhraeni Wirahadikusumah mengatakan Observatorium Bosscha diwacanakan menjadi pusat studi ilmu kebumian dan antariksa.
Ridwan Kamil Bantu Bobby Desain-Biayai Potensi Wisata di Medan: Bukan Politik,Gubernur Jawa Barat Ridwan Kamil berjanji akan membantu Wali Kota Medan Bobby Nasution untuk mendesain dan memberi akses pembiayaan potensi wisata di Medan.
"Musyawarah Relawan Jokowi di Jogja Berakhir, Ini Capres-Cawapres Favoritnya",Musyawarah Rakyat Relawan Jokowi di Jogja selesai digelar. Berikut hasil lengkap musyawarah tersebut.
Restu Ridwan Kamil untuk Atalia dan Ancaman Isu Politik Dinasti,"Gubernur Jabar Ridwan Kamil merestui istrinya, Atalia Praratya maju Pilwalkot Bandung 2024. Atalia mendapat lampu hijau untuk menapaki jejak politik Kang Emil."
Segini Harga Motor Listrik yang Dipakai Bobby Nasution-Ridwan Kamil Keliling Medan,Motor listrik Gesits menjadi sorotan usai digunakan oleh Wali Kota Medan Bobby Nasution. Berapa sih harga motor listrik buatan Cileungsi itu?
Ridwan Kamil Bagi Tips Jauhi Rentenir kepada Emak-emak di Medan,Gubernur Jawa Barat Ridwan Kamil mengingatkan emak-emak di Medan tak terjerat utang dari rentenir. Dia pun membagi tips untuk menghindari jeratan rentenir.
Saran Pakar Unpad untuk Atalia Praratya yang Mulai Kepincut Politik,"Pengamat politik Unpad menyarankan Atalia Praratya, istri Gubernur Jabar Ridwan Kamil tak terburu-buru gabung partai politik."
Perajin 99 Lampu Gentur Masjid Al Jabbar Meninggal Dunia,"Duduy, perajin lampu gentur meninggal dunia. Sebanyak 99 lampu gentur berukuran 1,5 meter yang menghiasi Masjid Al Jabbar Bandung, menjadi karya terakhirnya."
Wali Murid SDN Pocin 1 Adukan Walkot Depok ke RK: Hentikan Penggusuran!,Orang tua murid SDN Pondok Cina 1 meminta Gubernur Jawa Barat Ridwan Kamil memerintahkan Wali Kota Depok M Idris untuk menyetop penggusuran gedung SDN Pocin 1.
Ridwan Kamil-Bobby Nasution Keliling Medan Naik Motor Listrik,Gubernur Jawa Barat Ridwan Kamil dan Walkot Bobby Nasution keliling Kota Medan pakai motor listrik.
Latto-latto Menyenangkan Namun Berbahaya? Ini Kata Disdik DKI,Permainan latto-latto disebut menyenangkan namun berbahaya. Disdik DKI katakan ini.
"Ortu SD Pocin 1 Depok Datangi Kantor Ridwan Kamil, Adukan M Idris",Polemik rencana penggusuran SDN Pondok Cina (Pocin) 1 Kota Depok belum usai. Kelompok orang tua siswa SDN Pocin 1 kali ini mendatangi Gedung Sate.
"Datangi Kantor RK, Ortu SD Pocin 1 Depok Minta Penggusuran Dibatalkan!",Polemik rencana penggusuran SDN Pocin 1 Kota Depok masih belum usai. Kelompok orang tua siswa mendatangi Gesat untuk menyampaikan nota banding ke RK.
"Direstui RK Maju Pilwalkot Bandung, Atalia: Ada Pembicaraan di 3 Parpol","Atalia Praratya, istri Gubernur Jabar Ridwan Kamil mengaku ada pembicaraan dengan 3 partai terkait Pilwalkot Bandung."
"Respons PKS, NasDem, Golkar soal Atalia Dapat Restu RK Maju Pilwalkot","Sejumlah partai di Kota Bandung merespons soal Atalia Praratya yang mendapatkan restu dari suaminya, Gubernur Jabar Ridwan Kamil maju di Pilwalkot Bandung."
Deretan Fakta Ridwan Kamil Restui Atalia Maju di Pilwalkot Bandung,"Gubernur Jabar Ridwan Kamil merestui istrinya, Atalia Praratya mengikuti jejak politiknya. Ridwan Kamil merestui Atalia maju di Pilwalkot Bandung 2024."
Observatorium Bosscha dan Hal Menarik dalam Perjalanannya,Observatorium Bosscha genap berusia 100 tahun pada Januari 2023 ini. Ada hal menarik yang mengiringi perjalanannya.
Restu Ridwan Kamil untuk Atalia Maju Pilwalkot Bandung 2024,Gubernur Jabar Ridwan Kamil merestui istrinya Atalia Praratya maju di Pilwalkot Bandung 2024.
Ridwan Kamil Soal Usulan Cak Imin Hapuskan Gubernur: Tanya Rakyat,"Ridwan Kamil menilai soal usulan penghapusan jabatan gubernur itu bisa dilakukan dengan referendum. Untuk itu, dia meminta agar bertanya ke rakyat."
"Atalia Masuk Bursa Walkot Bandung, Ridwan Kamil: Kapasitas Memang Ada","Istri Ridwan Kamil (RK), Atalia Praratya, masuk bursa calon Wali Kota Bandung. RK menyebutkan istrinya memang memiliki kapasitas."
Jabar Hari Ini: Persib Kudeta Persija di Puncak Klasemen Liga 1,Sejumlah peristiwa mewarnai pemberitaan di Jawa Barat hari ini. Mulai dari Persib kembali ke puncak klasemen Liga 1 hingga babak baru kasus kecelakaan Cianjur.
"Kelakar Ridwan Kamil: Pak Edy Cocok Jadi Presiden, Ada Kerutan","Ridwan Kamil menjawab pertanyaan soal kemungkinan dirinya maju sebagai capres. Sambil berkelakar, Ridwan Kamil menyebut Edy Rahmayadi yang cocok jadi presiden."
Respons Golkar soal Niat Istri Ridwan Kamil Gabung Partai,"Atalia Praratya, istri Ridwan Kamil mempertimbangkan untuk gabung dengan Partai Golkar. Merespons niatan itu, Partai Golkar siap membuka pintu untuk Atalia."
"RK Soal Istrinya Masuk Bursa Walkot Bandung: Survei Bagus, Kapasitas Ada","Ridwan Kamil mengomentari soal kabar istrinya bakal maju sebagai calon Wali Kota Bandung. Dia menyebut survei terhadap istrinya, Atalia Praratya, bagus."
"Berlabuh ke Golkar, Rian Ernest Terinspirasi dari Ridwan Kamil",Rian Ernest resmi menjadi kader Partai Golkar. Rian memlih Golkar karena menganggap partai ini besar dan memiliki banyak orang hebat.
"Soal Maju Jadi Capres, Ridwan Kamil: Tidak Diambisikan",Ridwan Kamil mengaku tahu diri dan membiarkan takdir yang mengatur terkait maju ke arena Pilpres 2024 sebagai capres.
Atalia Kantongi Restu Ridwan Kamil untuk Maju Pilwalkot Bandung,Atalia Praratya mengaku sudah mendapatkan restu dari Ridwan Kamil untuk maju Pilkada.
"Ikuti Jejak Suaminya Ridwan Kamil, Atalia Pertimbangkan Gabung Golkar","Ridwan Kamil kini sudah resmi menjadi kader Partai Golkar. Jejak Kang Emil ini pun rencananya bakal diikuti oleh istrinya, Atalia Praratya."
RK Soal Pembangunan Patung Bung Karno: Tak Pakai Dana APBD,Ridwan Kamil menanggapi soal kritikan pembuatan patung Bung Karno di Bandung. RK mengatakan pembuatan patung tak menggunakan dana APBD.
Ridwan Kamil Restui Atalia Praratya Maju di Pilwalkot Bandung,Atalia Praratya mengaku sudah mendapatkan restu dari Ridwan Kamil untuk maju di Pilwalkot Bandung. Akankah Atalia maju di Pilwalkot Bandung usai mendapat restu?
"Soal Capres, RK: Biarkan Takdir yang Atur, Tidak Diambisikan",Ridwan Kamil jawab soal dirinya kemungkinan diusung ke sebagai bakal capres. Politisi Golkar itu mengatakan tahu diri dan membiarkan takdir yang mengatur.
Ridwan Kamil Ungkap Hasil Survei Jabar Provinsi Toleran,Gubernur Jabar Ridwan Kamil mengungkap data hasil survei yang menunjukkan bahwa Jawa Barat merupakan provinsi yang toleran.
"RK: Urusan Transportasi Publik di Jabar Sedang Dikerjakan, Butuh Proses","Ridwan Kamil menegaskan persoalan transportasi publik di Jawa Barat saat ini sedang dikerjakan. Namun, menurutnya, hal itu membutuhkan proses."
"Observatorium Bosscha Genap 1 Abad, Traveler Pernah Singgah?",Observatorium Bosscha genap berusia satu abad tahun ini. Observatorium astronomi modern pertama di Asia Tenggara.
Guru Besar Unpad Pimpin Usulan Inggit Garnasih Jadi Pahlawan,Pemprov Jabar menunjuk guru besar dari Universitas Padjajaran untuk mendapatkan gelar pahlawan.
RK Gercep Tindaklanjut Usulan Inggit Garnasih Jadi Pahlawan Nasional,Ridwan Kamil gercep tindak lanjut usulan Megawati yang ingin Inggit Garnasih menjadi pahlawan nasional.
Upaya Lestarikan Observatorium Bosscha di Usianya yang Seabad,Observatorium Bosscha kini berusia satu abad. Gubernur Jabar Ridwan Kamil pun akan memperjuangkan lokasi tersebut sebagai bangunan cagar budaya.
"Profil Inggit Garnasih: Diusulkan Jadi Pahlawan Nasional, Ibu Kos-Istri Sukarno",Inggit Garnasih diusulkan sebagai Pahlawan Nasional oleh Megawati. Berikut profil dan jasanya.
Pakar Unpad Soroti Keluarga Soekarno soal Inggit Jadi Pahlawan Nasional,"Guru Besar Unpad Muradi menilai, usulan Megawati untuk menjadikan Inggit Garnasih perlu persetujuan dari keluarga besar Bung Karno."
Permintaan Maaf Fatmawati Istri Bung Karno kepada Inggit Garnasih,"Fatmawati, istri Soekarno, meminta maaf kepada Inggit Garnasih. Momen ini terekam dalam sebuah foto yang terpajang di Rumah Bersejarah Inggit Garnasih."
Viral 'Negeri Peri' di Pangandaran,Viral di media sosial ada 'negeri peri' di Pangandaran yang suasananya begitu eksotis. Simak di sini ulasannya.
Pencinta Mercedes-Benz dari Berbagai Negara Bakal Ngumpul di Indonesia,"Ribuan pemilik, penggemar, komunitas dan pencinta Mercedes-Benz akan berkumpul dalam ajang Merceday-Benz."
Respons Keluarga soal Usulan Inggit Garnasih Jadi Pahlawan Nasional,"Cucu angkat Inggit Garnasih, Tito Asmarahadi angkat bicara terkait keinginan Ketum PDIP Megawati Soekarnoputri yang mengusulkan Inggit jadi pahlawan nasional."
Berkenalan dengan Juru Pelihara Rumah Bersejarah Inggit Garnasih,"Sudah 23 tahun lamanya, Jajang Ruhyat (47) menjadi juru pelihara sekaligus pemandu Rumah Bersejarah Inggit Ganarsih di Kota Bandung."
Siapa Sosok Inggit Garnasih yang Diusulkan Jadi Pahlawan Nasional oleh Megawati?,Inggit Garnasih diusulkan sebagai pahlawan nasional oleh Megawati. Bagaimana sosoknya?
Inggit Garnasih 'Diantar' Megawati ke Gerbang Pahlawan Nasional,Megawati seolah mengantar Inggit ke 'pintu gerbang' penghormatan sebagai pahlawan nasional.
RK Terharu Megawati Usulkan Inggit Garnasih Jadi Pahlawan Nasional,Gubernur Jawa Barat Ridwan Kamil mengaku terharu mendengar permintaan Ketua Umum PDIP Megawati Soekarnoputri soal Inggit Garnasih.
Pemkot Depok Bakal Tertibkan Warga yang Nongkrong di Underpass Dewi Sartika,Kelakuan sejumlah warga menggunakan underpass Dewi Sartika Depok untuk nongkrong viral. Wali Kota Depok mengingatkan underpass tak layak untuk nongkrong.
"Diusulkan Megawati Jadi Pahlawan Nasional, Ini Jasa Inggit Garnasih",Inggit merupakan perempuan yang ikut berjuang membantu Soekarno demi cita-cita kemerdekaan.
Megawati Minta RK Perjuangkan Inggit Garnasih Sebagai Pahlawan Nasional,Ketua PDIP Megawati Soekarnoputri berpesan agar Gubernur Jawa Barat Ridwan Kamil memperjuangkan Inggit Garnasih sebagai pahlawan nasional.
Sosok Inggit Garnasih yang Diusulkan Megawati Jadi Pahlawan Nasional,Ketum PDIP Megawati Soekarnoputri mengusulkan Inggit Garnasih sebagai pahlawan nasional. Inggit diketahui sebagai istri kedua Sukarno.
"Megawati Usul Inggit Garnasih Jadi Pahlawan Nasional, Ridwan Kamil Terharu",Megawati berpesan kepada Ridwan Kamil untuk memperjuangkan Inggit Garnasih sebagai pahlawan nasional. Ridwan Kamil mengaku sangat terharu atas usulan itu.
Pesan Megawati ke RK: Perjuangkan Inggit Garnasih sebagai Pahlawan Nasional,Ketum PDIP Megawati Soekarnoputri berpesan kepada Gubernur Jawa Barat Ridwan Kamil (RK) untuk memperjuangkan Inggit Garnasih sebagai pahlawan nasional.
"PDIP Gelar Senam Bersama di Gedung Sate, Ridwan Kamil Hadir Berbaju Merah","PDIP menggelar senam di pelataran Gedung Sate, Kota Bandung. Gubernur Jabar Ridwan Kamil tampak hadir menggunakan baju merah."
"Elektabilitas Cawapres di Papan Teratas, Erick Thohir: Nggak Ada yang Dukung",Erick Thohir menilai percuma jika tidak ada dukungan parpol menanggapi hasil survei yang menunjukkan elektabilitasnya sebagai cawapres di posisi teratas.
Pesawat Airlangga dan RK Gagal Mendarat di Manado gegara Banjir,Ketum Partai Golkar Airlangga dan Waketum Partai Golkar RK mengalami pengalaman kurang menyenangkan. Pesawat yang ditumpangi keduanya gagal mendarat di Manado.
NasDem Karawang Klaim Anies Akan Ungguli Prabowo di Pemilu 2024,Ketua DPD Partai NasDem Kabupaten Karawang Dian Fahrudjaman menyebut popularitas Anies Baswedan mengungguli Prabowo pada Pilpres 2024 mendatang.
"Pekan Terakhir! Muncul Nama Baru di Top 5 Cawapres The Matchmaker, Siapa?",Sesi memilih dan menjodohkan tokoh favorit untuk menjadi pasangan capres dan cawapres di The Matchmaker memasuki pekan terakhir. Yuk vote sekarang!
SMRC Sebut RK Bisa Saingi Suara Prabowo dan Anies di Jawa Barat,Pendiri SMRC Saiful Mujani menyatakan Gubernur Jawa Barat Ridwan Kamil bisa menyaingi suara Prabowo Subianto dan Anies Baswedan di daerahnya.
"Lapor ke Airlangga, RK Pamer Investasi di Jabar 2022 Terbesar Dalam Sejarah",Gubernur Jawa Barat (Jabar) Ridwan Kamil melaporkan kinerja ekonomi Jabar ke Menko Perekonomian Airlangga Hartarto.
"Stok Beras di Jabar Surplus, Tak Perlu Impor",Gubernur Jawa Barat Ridwan Kamil tidak setuju dengan rencana impor beras yang bakal dilakukan pemerintah lantaran Jabar masih miliki stok beras yang cukup.
'Tamparan' Gerindra Jabar kepada Figur Mencla-mencle,Gerindra Jabar memberi tamparan keras. Gerindra menegaskan tak akan mengusung figur yang mencla-mencle pada Pilgub Jabar 2024.
Airlangga Minta RK Tingkatkan Target Kursi Legislatif Golkar di Jawa,"Ketum Golkar, Airlangga Hartarto menghadiri Rakornis pemenangan Pemilu wilayah Jawa I (Banten, DKI Jakarta dan Jawa Barat)."
Airlangga Sapa Airin Rachmi 'Gubernur Banten' di Rakornis Golkar,Ketua Umum Golkar Airlangga Hartarto sempat menyapa Ketua Umum Pimpinan Pusat Kesatuan Perempuan Partai Golkar (PP KPPG) Airin Rachmi Diany sebagai 'gubernur'.
"Ada RK, Airlangga Tambah Target Kursi Parlemen Golkar di Jabar-DKI 2024","Airlangga berharap dengan masuknya Ridwan Kamil atau Kang Emil ke Golkar, dapat menambah jumlah kursi yang diperoleh Golkar di Pemilu 2024."
"Gerindra Jabar Ogah Usung Figur Mencla-mencle di Pilgub, PKB Singgung RK",Gerindra Jabar tak akan mengusung sosok mencla-mencle di Pilgub Jabar. PKB Jabar menyinggung nama Gubernur Jabar Ridwan Kamil (RK) soal figur mencla-mencle.
"Gerindra Ogah Usung Figur Mencla-mencle, PKB Singgung Sosok RK",Gerindra sudah memastikan tidak akan mengusung figur mencla-mencle di Pilgub Jabar 2024 mendatang. Ini kata PKB Jabar.
Membaca Maksud Gerindra Ogah Usung Figur Mencla-mencle di Pilgub Jabar,"Partai Gerindra menegaskan takkan mengusung figur yang mencla-mencle untuk Pilgub Jawa Barat 2024 mendatang. Lantas, siapa figur yang dimaksud oleh Gerindra?"
"Musra Relawan Jokowi di Kalsel: Airlangga Capresnya, Mahfud Cawapres",Gabungan relawan Presiden Joko Widodo (Jokowi) selesai menggelar Musyawarah Rakyat (Musra) XV di Kalimantan Selatan.
"Fenomena Sosial ""Latto-Latto""",Suara latto-latto yang khas itu dalam beberapa bulan terakhir ini telah meramaikan ruang dan peristiwa pendengaran kita.
Survei Algoritma: Ganjar-Prabowo Dianggap Sosok Tepat Penerus Jokowi,"Algoritma Research & Consulting melakukan survei terkait sosok yang akan melanjutkan kebijakan Jokowi. Hasilnya ada nama Ganjar, Prabowo hingga Ridwan Kamil."
Gembiranya Sahrul Gunawan Sambut Ridwan Kamil di Golkar,Wabup Bandung Sahrul Gunawan menyambut gembira bergabungnya Ridwan Kamil ke Partai Golkar. Ia yakin Golkar akan makin besar.
Aher Soal Ridwan Kamil Gabung Golkar: Sulit Jadi Pejabat Tanpa Parpol,Gubernur Jabar Ridwan Kamil telah bergabung ke Partai Golkar. Mantan Gubernur Jabar Ahmad Heryawan pun menanggapi soal langkah politik Ridwan Kamil itu.
"Peta Kekuatan Ganjar, Prabowo dan Anies di Survei Capres, Siapa Paling Unggul?","Ganjar Pranowo, Prabowo Subianto dan Anies Baswedan bersaing ketat dalam hasil survei Capres 2024. Berikut peta kekuatan tiga nama itu."
Menengok Jembatan Kereta Api Terpanjang di Indonesia,"Mengingat kembali jejak sejarah jalur kereta api (KA) Banjar-Cijulang dengan melihat jembatan KA terpanjang di Indonesia. Letaknya di Desa Pamotan, Kalipucang."
Peta Kekuatan 3 Capres Terkuat di Awal 2023 dari 5 Survei Terhangat,"Terdapat 5 lembaga survei yang merilis penelitiannya soal kekuatan Capres. Mereka menggambarkan bagaimana persaingan antara Ganjar, Prabowo, dan Anies Baswedan."
Kala Pedagang Bakso Tahu di Bandung 'Dikepung' Tentara Amerika,Foto menggambarkan pedagang bakso tahu di Bandung 'dikepung' Tentara Amerika bikin geger media sosial. Para tentara itu jajan bakso tahu dan menyukainya.
Menanti Langkah Politik Ridwan Kamil Usai Gabung Golkar,"Ridwan Kamil kini sudah jadi bagian Partai Golkar. Kini, langkah politik Ridwan Kamil pun dinantikan publik usai jadi kader partai politik."
"Survei Capres 2024 LSI: Ganjar Unggul, Prabowo dan Anies Saling Kejar","LSI merilis hasil simulasi Pilpres 2024. Hasilnya, Ganjar Pranowo mengungguli hasil survei sementara Prabowo dan Anies saling kejar."
"Terpopuler Sepekan: Serial Killer Cianjur, Ridwan Kamil Masuk Golkar","Terpopuler Sepekan: Serial Killer Cianjur, Ridwan Kamil Masuk Golkar"
Pesan Tokoh Senior Golkar untuk Ridwan Kamil,Gubernur Jabar Ridwan Kamil telah bergabung ke Partai Golkar. Ridwan Kamil pun mengaku sudah bersilaturahmi ke sejumlah tokoh senior Golkar.
"Blusukan ke Karawang, Anies Buka Turnamen Voli Antar Kampung",Anies Baswedan mekakukan kunjungan ke Kabupaten Karawang. Berbagai kegiatan dia lakukan termasuk buka turnamen voli antar kampung.
"Diajak RK Menengok Keindahan Masjid Al Jabbar, Jusuf Kalla: Luar Biasa",Ridwan Kamil mengajak Wakil Presiden Indonesia 2014-2019 Jusuf Kalla berkunjung ke Masjid Raya Al Jabbar. Jusuf Kalla mengaku kagum dengan keindahan Al Jabbar.
Polisi Akan Tertibkan Anak Muda Depok Nongkrong di Underpass Dewi Sartika,"Video memperlihatkan sekelompok anak muda nongkrong di underpass Dewi Sartika, Depok. Pihak kepolisian akan menertibkan."
Menengok Kondisi Jalur Alternatif ke Masjid Al Jabbar di Akhir Pekan,"Akses jalan menuju ke Masjid Raya Al Jabbar menuai kritik lantaran kerap dilanda kemacetan. Namun, kondisi terkini menuju masjid via Summarecon sepi."
Ridwan Kamil Bidik Investasi Tambang di Sulawesi Tengah,Gubernur Jawa Barat Ridwan Kamil meminta Gubernur Sulawesi Tengah Rusdy Mastura membuka pintu investasi untuk para pengusaha tambang asal Jabar.
Respons Ridwan Kamil soal Tingginya Angka Pernikahan Dini di Jabar,Gubernur Jabar Ridwan Kamil merespons tingginya kasus pernikahan dini di Jawa Barat.
Jabar Hari Ini: Kekejaman Wowon Cs hingga Pilu Nenek Pencari Keadilan,"Beragam peristiwa terjadi di Jabar hari ini. Dari mulai pembunuhan keji Wowon terhadap empat istrinya, hingga langkah politik Gubernur Jabar Ridwan Kamil."
"Resmikan Situ Gede Bogor, Ridwan Kamil Naik Kano Warna Kuning",Gubernur Jawa Barat Ridwan Kamil didampingi Wali Kota Bogor Bima Arya meresmikan revitalisasi Situ Gede di Bogor Barat Kota Bogor. Ia menaiki kano warna kuning
PPP Pede Kekuatan Pemprov Jabar Bertambah Usai RK Gabung Golkar,Bergabungnya Ridwan Kamil ke Partai Golkar diyakini akan menambah kekuatan Ridwan Kamil dan Uu Ruzhanul Ulum di Pemprov Jabar.
Ridwan Kamil Legawa Maju di Pilkada Usai Gabung Golkar,Gubernur Jawa Barat Ridwan Kamil bicara soal peluang perjalanan politiknya di Pemilu 2024 usai resmi gabung dengan Partai Golkar.
"Suara Ridwan Kamil Naik Signifikan di The Matchmaker, Ini Hasil Sementaranya",Suara Ridwan Kamil naik signifikan di The Matchmaker pekan ini. Ada yang vote RK sebagai capres dan ada juga yang dukung jadi cawapres. Ini hasil sementaranya
"Gibran Siap Maju Cagub 2024, Bagaimana Kekuatannya di Survei?",Walkot Solo Gibran Rakabuming Raka menyatakan siap maju sebagai bakal cagub jika ditugaskan PDIP. Seberapa kuat nama Gibran di hasil sejumlah survei pilgub?
"Ridwan Kamil Bonceng Anak di Dek Vespa, Bahaya Nggak Sih?","Arkana dibonceng dengan berdiri di area dek Vespa. Dari kaca mata safety riding, membonceng balita seperti itu, amankah?"
"Mengintip Fasilitas Tasik Creative Center, 'Gedung Mahal' Versi RK",Kota Tasikmalaya memiliki sarana baru untuk mendukung aktivitas para pelaku usaha ekonomi kreatif. Hal itu menyusul rampungnya Tasik Creative Center.
Target PKS di Pilwalkot Bandung 2024,Partai Keadilan Sejahtera (PKS) telah menyiapkan kader-kader potensial yang bakal diusung pada Pilwalkot Bandung 2024.
"Profil Kiky Saputri, Komika yang Berani Roasting Pejabat",Simak perjalanan karier Kiky Saputri hingga deretan roasting-an sang komika buat deretan pejabat.
Ridwan Kamil Disebut Tepat Gabung ke Partai Golkar,"Bergabungnya Ridwan Kamil ke Partai Golkar dinilai sebagai pilihan tepat. Di saat bersamaan, Ridwan Kamil juga akan memberi dampak positif bagi Golkar."
"Alokasi Kursi Dapil Bergeser, PDIP Bali Ogah Ambil Pusing",PDIP Bali mengaku tak ambil pusing terkait rancangan dapil pemilu 2024 yang membuat alokasi kursi di Badung dan Buleleng bergeser.
"Underpass Dewi Sartika Depok Resmi Beroperasi, Ini Kata Warga","Sejumlah warga menyambut antusias pengoperasian underpass Dewi Sartika, Depok. Mereka mengklaim underpass itu berhasil mengatasi kemacetan."
"Pilih Masuk Golkar, Ridwan Kamil Dinilai Incar Tiket Cawapres",Ridwan Kamil resmi berlabuh ke Partai Golkar. Sosok yang juga terkenal sebagai arsitek tersebut dinilai sedang mengincar tiket calon wakil presiden.
Menjajal Underpass Depok yang Katanya Bisa Urai Kemacetan,"Underpass Dewi Sartika telah resmi dibuka sejak Selasa (17/1). Underpass ini digadang-gadang mampu mengurai kemacetan, benarkah?"
Menjajal Jalur Alternatif Menuju Masjid Al Jabbar Bandung,"Arus lalu lintas menuju kawasan Masjid Raya Al Jabbar, Kota Bandung, menjadi sorotan karena kemacetan parah selalu terjadi saat akhir pekan."
Bergabungnya Ridwan Kamil Bikin Pede Golkar Pangandaran,"Bergabungnya Ridwan Kamil ke Partai Golkar disambut positif para kader. Bahkan, Ridwan Kamil diyakini akan membawa efek sinifikan di Pangandaran."
Golkar soal Kemungkinan RK Cawapres Dampingi Airlangga: Dia Tahu Diri,Ace bicara terkait kemungkinan Ridwan Kamil menjadi cawapres pendamping Airlangga. Ace mengungkap RK sempat menyampaikan dirinya tahu diri.
"Kurang Bayar Iuran Partai, Anggota DPRD Kota Sukabumi Kena PAW","Seorang anggota DPRD Kota Sukabumi aktif dari fraksi PAN, Faisal Anwar di-PAW partai. Keputusan itu diduga karena Faisal tak membayar 'setoran' pada partai."
"RK Gabung ke Golkar, Komunikolog Nilai Airlangga Jeli Melihat Peluang",Komunikolog Indonesia Emrus Sihombing menilai bergabungnya Ridwan Kamil (RK) ke Partai Golkar menguntungkan dan membawa nilai positif untuk kedua belah pihak.
Suara Nasdem dan Gelora Usai Ridwan Kamil Gabung Golkar,Gubernur Jabar Ridwan Kamil telah bergabung ke Partai Golkar. Apa respons Nasdem Jabar dan Gelora Jabar?
RK Merapat ke Golkar tapi Capresnya Tetap Airlangga,"Ridwan Kamil resmi jadi kader dan memegang kartu anggota Partai Golkar. Bertugas memenangkan pemilu, Ridwan Kamil menggaungkan Airlangga Hartarto capres Golkar."
Asal-usul Batik 'Ironman' yang Dipakai RK di Markas Golkar,Ridwan Kamil memakai batik bermotif 'Ironman Telorceplok' sebelum diresmikan menjadi kader partai Golkar. Simak asal-usul batik bermotif unik tersebut.
Lembaran Baru Ridwan Kamil Usai Gabung Partai Golkar,Ridwan Kamil sudah sah menjadi kader Partai Golkar. Kini Ridwan Kamil punya lembaran hidup baru dalam perjalanan politiknya.
Menakar Peluang Ridwan Kamil Usai Gabung Golkar,Ridwan Kamil resmi menjadi kader partai Golkar dalam menatap Pemilu 2024. Bagaimana peluangnya di partai berlambang pohon beringin itu?
Ijeck Sambut Ridwan Kamil yang Gabung Golkar: Akhirnya Terkuning-kuning,Musa Rajekshah (Ijeck) menyambut dengan gembira Ridwan Kamil yang bergabung ke Golkar. Ijeck menyebut Ridwan Kamil akhirnya terkuning-kuning.
"Ridwan Kamil Gabung Golkar, Langsung Jabat Waketum DPP",Ridwan Kamil resmi bergabung dengan Partai Golkar. Dia langsung menjabat sebagai Waketum DPP Golkar usai bergabung.
