Judul,Konten
Jabar Hari Ini: Ridwan Kamil Berlabuh ke Partai Golkar,"Beragam peristiwa terjadi di Jabar hari ini, Rabu (18/1/2023). Dari mulai kasus pemerkosaan di Sukabumi hingga Ridwan Kamil bergabung Partai Golkar."
Ridwan Kamil: Followers 30 Juta di Medsos Jadi Modal Strategi di Golkar,Gubernur Jawa Barat Ridwan Kamil resmi bergabung ke Partai Golkar. RK mengatakan pengikutnya sebanyak 30 juta di media sosial jadi modal menjalankan tugasnya.
"Ternyata, Sudah 2 Tahun Lamanya Ridwan Kamil Lirik Golkar","Gubernur Jawa Barat, Ridwan Kamil, mengaku telah melirik Partai Golkar sejak lama. Ia telah meminta izin kepada senior Partai Golkar sebelum akhirnya bergabung."
Sederet Pertimbangan Ridwan Kamil Pilih Partai Golkar untuk Berlabuh,"Gubernurnya Jawa Barat, Ridwan Kamil mengungkap alasan bergabung dengan Partai Golkar. Diantaranya, karena kedekatan dengan Ketum Airlangga Hartarto."
"Resmi Jadi Kader Golkar, RK: Nanti Banyak Anak Muda 'Menguning'","Gubernur Jawa Barat, Ridwan Kamil telah resmi menjadi kader Partai Golkar. RK berkomitmen untuk menggaungkan Airlangga sebagai capres."
"Jadi Waketum, Ridwan Kamil Ngaku 'Lirik' Golkar 2 Tahun Lebih",Gubernur Jabar Ridwan Kamil resmi bergabung ke Partai Golkar dan ditunjuk sebagai Waketum. Ridwan Kamil mengaku telah 'melirik' Golkar lebih dari 2 tahun.
"Ridwan Kamil Masuk Golkar, Pacul PDIP Ogah Komentar Rumah Tangga Partai Lain",Ridwan Kamil resmi bergabung ke Golkar hari ini. Ketua Bapilu PDP Bambang Wuryanto atau Bambang Pacul menilai itu hak politik setiap orang.
"Resmi Jadi Kader Golkar, Ridwan Kamil Bertugas Menangi Pemilu",Gubernur Jawa Barat Ridwan Kamil resmi jadi kader Golkar. RK ditugaskan untuk menjadi Waketum Bidang Penggalangan Pemilih Partai Golkar.
Titah Airlangga buat Ridwan Kamil: Galang Suara untuk Golkar,Ridwan Kamil resmi menjadi kader Partai Golkar. Gubernur Jawa Barat ini pun langsung mendapat tugas khusus dari Ketua Umum Airlangga Hartarto.
Partai Golkar Jadi Pilihan Ridwan Kamil,Ridwan Kamil resmi bergabung dengan Partai Golkar pada Rabu (18/1/2023). Gubernur Jawa Barat itu diberi jabatan Wakil Ketua Umum Bidang Penggalangan Pemilih.
"RK Didapuk Jadi Waketum Golkar, Siap Gaungkan Airlangga Capres!",Gubernur Jawa Barat Ridwan Kamil langsung didapuk menjadi wakil ketua umum (waketum) bidang penggalangan pemilih Partai Golkar.
Ridwan Kamil Ungkap Alasan Berlabuh ke Golkar: Partai Tengah,Gubernur Jawa Barat Ridwan Kamil resmi bergabung ke Golkar. Ridwan Kamil mengungkapkan alasan memilih partai berlogo pohon beringin itu sebagai tempat berlabuh.
"Ridwan Kamil Jadi Waketum Golkar, Siap Gaungkan 'Airlangga Capres'",Ridwan Kamil resmi bergabung dengan Partai Golkar. Ridwan Kamil ditunjuk oleh Ketum Golkar Airlangga Hartarto sebagai wakil ketua umum.
Tugas Khusus Ridwan Kamil Usai Resmi Gabung Golkar,Gubernur Jawa Barat RK telah resmi menjadi kader Partai Golkar. Ketum Partai Golkar Airlangga Hartarto memberikan tugas khusus untuk RK usai resmi bergabung.
Cerita Batik Iron Man yang Dipakai Ridwan Kamil Saat Gabung Golkar,Gubernur Jawa Barat Ridwan Kamil resmi bergabung dengan Partai Golkar dan diumumkan oleh Ketua Umum Airlangga Hartarto di kantor DPP Partai Golkar
Sah! Ridwan Kamil Resmi Jadi Kader Golkar,Gubernur Jawa Barat (Jabar) Ridwan Kamil telah resmi menjadi kader Partai Golkar!
"Pakai Jas Kuning, Ridwan Kamil Resmi Jadi Kader Partai Golkar!",Gubernur Jabar Ridwan Kamil sah menjadi kader Partai Golkar. Resminya Ridwan Kamil jadi kader Partai Golkar ditandai dengan jas warna kuning yang dikenakannya.
Gaya Ridwan Kamil Pakai Batik Kuning Saat Tiba di DPP Golkar,"Gubernur Jabar, Ridwan Kamil tiba di DPP Partai Golkar. RK yang mengenakan batik berwarna kuning tak banyak berkomentar dan langsung masuk ke kantor Golkar."
Respons PAN Jabar soal Ridwan Kamil Gabung Golkar,"DPW PAN Jabar memastikan komunikasi partainya dengan Ridwan Kamil, yang akan bergabung dengan Golkar, tak akan putus."
PKB Tak Masalah Ridwan Kamil Gabung Golkar: Itu Hak Politik,Gubernur Jabar RK dipastikan akan bergabung ke Partai Golkar hari ini. Wasekjen DPP PKB Syaiful Huda menghargai pilihan RK.
Ridwan Kamil Tiba di DPP Golkar Jelang Pengumuman Gabung Partai,Gubernur Jawa Barat Ridwan Kamil tiba di Kantor DPP Partai Golkar. Ridwan Kamil akan diumumkan bergabung dengan Partai Golkar.
Golkar Tetap Capreskan Airlangga Meski Ada Sosok RK,"Gubernur Jawa Barat, Ridwan Kamil bakal bergabung dengan Partai Golkar. Ketua DPP Partai Golkar, Ace Hasan memastikan Golkar tetap mengusung Ketum, Airlangga"
Ridwan Kamil 100 Persen Gabung Golkar!,Gubernur Jawa Barat Ridwan Kamil sudah dipastikan 100 persen bakal bergabung dengan Partai Golkar untuk mengarungi Pemilu 2024 mendatang.
"Ada Baliho 'Terima Kasih Wali Kota Depok atas Underpass', Ini Profil Underpass Depok",Sebuah baliho berisi ucapan terima kasih dari warga Depok kepada Wali Kota Depok M Idris atas underpass Dewi Sartika muncul di dekat underpass Dewi Sartika.
Lika-liku Perjalanan Politik Ridwan Kamil Sebelum Masuk Golkar,Gubernur Jabar Ridwan Kamil atau RK telah mengambil keputusan soal kelanjutan karir politiknya. RK rencananya akan diumumkan masuk Partai Golkar sore nanti.
Ace Hasan Harap RK Bisa Bantu Pemenangan Golkar di 2024,"Ridwan Kamil bakal bergabung dengan Partai Golkar. Ketua DPP Golkar, Ace Hasan Syadzily berharap bergabungnya RK dapat membantu pemenangan Golkar di 2024."
Golkar Unggah RK Berjaket Kuning Jelang Pengumuman Gabung Partai,"Ridwan Kamil bakal diumumkan menjadi kader Golkar hari ini. Jelang pengumuman, RK dan Golkar mengunggah serba kuning di media sosial."
Golkar Tetap Capreskan Airlangga Hartarto Meski RK Akan Bergabung,"Gubernur Jabar RK akan bergabung dengan Partai Golkar hari ini. Meski begitu, Golkar akan tetap konsisten mengusung Ketum Airlangga Hartarto sebagai capres."
Unggahan Serba-kuning Jelang Pengumuman Ridwan Kamil Gabung Golkar,"Ridwan Kamil bakal diumumkan menjadi kader Partai Golkar hari ini, Rabu (18/1/2023). Rencananya, Ketum Airlangga Hartarto akan mengumumkan secara langsung."
Perjalanan Ridwan Kamil hingga Bakal Diumumkan Jadi Kader Golkar,"Jika tidak ada halangan, rencananya, Ridwan Kamil bakal diumumkan secara resmi bergabung dengan partai berlambang beringin kuning di kantor DPP Partai Golkar."
Golkar Umumkan RK Gabung Partai Sore Ini,Gubernur Jawa Barat Ridwan Kamil (RK) telah mantap menetapkan perahu politiknya. RK rencananya akan gabung Partai Golkar pada sore hari ini.
"Ridwan Kamil Masuk Golkar Sore Ini, PAN Puji Langkah Berani",Ridwan Kamil menyatakan akan masuk ke Golkar sore ini. Ketua DPP PAN Bima Arya mengatakan hal yang dilakukan Ridwan Kamil merupakan langkah yang berani.
"Ada Underpass, Lalin Jalan Dewi Sartika Depok Arah Margonda Lancar Pagi Ini","Underpass Jalan Dewi Sartika, Depok, telah diresmikan dan bisa digunakan oleh warga. Lalu lintas di Jalan Dewi Sartika arah Jalan Margonda Raya pun lancar."
Fakta-fakta Tentara Amerika Borong Bakso Tahu di Bandung,"Tentara Amerika Serikat (AS) bikin heboh usai 'menyerbu' penjual bakso tahu di Markas Yonif Para Raider 330/Tridharma, Cicalengka, Kabupaten Bandung."
Alun-alun Singaparna Tasik yang Diresmikan Ridwan Kamil Tuai Sorotan,"Pembangunan Alun-alun Singaparna, Kabupaten Tasikmalaya, Jawa Barat, mendapat sorotan dari berbagai pihak karena menggunakan lahan desa."
Pembangunan Alun-alun Laut Palabuhanratu Dimulai Maret 2023,"Rencana pembangunan Alun-alun Laut Palabuhanratu, Kabupaten Sukabumi akan segera terealisasi. Pembangunan ruang publik tersebut akan dimulai pada Maret 2023."
Lelang Pengelolaan TPPAS Legok Nangka Ditargetkan Rampung Tahun Ini,"Pemprov Jawa Barat memproyeksikan lelang pengelolaan Tempat Pengolahan dan Pemrosesan Akhir Sampah Legok Nangka, Kabupaten Bandung bisa rampung tahun ini."
RK Minta Walkot Depok Tambah CCTV di Underpass Dewi Sartika Cegah Vandalisme,Ridwan Kamil bersama M Idris meresmikan underpass Dewi Sartika Kota Depok. RK meminta Pemkot Depok menambah CCTV untuk mencegah aksi vandalisme.
Ambisi Golkar Rebut Kembali Kursi Wali Kota Bandung,Partai Golkar tengah meracik strategi untuk bertarung di Pilwalkot Bandung 2024. Golkar punya target raihan suara dan kursi di Pileg Kota Bandung 2024.
Ridwan Kamil dan Walkot Depok Resmikan Underpass Dewi Sartika,"Gubernur Jawa Barat Ridwan Kamil (RK) bersama Wali Kota (Walkot) Depok M Idris meresmikan underpass Dewi Sartika Kota Depok, Jawa Barat."
Ridwan Kamil Bakal Diumumkan Jadi Kader Golkar di Kantor DPP,Ridwan Kamil menyatakan bakal mengumumkan secara resmi bergabung dengan Partai Golkar pada Rabu (18/1/2023).
Momen Jokowi-Sultan HB X Duduk Berdampingan Makan Nasi Kotak,Jokowi dan Sultan HB X duduk berdampingan sambil makan nasi kotak. Momen itu saat makan siang dalam Rakornas Kepala Daerah dan Forkopimda Se-Indonesia.
Ridwan Kamil: Kemungkinan Besok Sore Masuk Golkar,"""Kemungkinan besok sore masuk Golkar,"" kata Gubernur Jawa Barat Ridwan Kamil di Depok."
"Jokowi Makan Nasi Kotak Bareng Gubernur, Semeja dengan RK hingga Sultan HB X",Presiden Jokowi makan siang bareng para gubernur yang hadir dalam Rakornas Kepala Daerah dan Forum Komunikasi Pimpinan Daerah (Forkopimda) Se-Indonesia.
Warga Depok Antusias Hadiri Peresmian Underpass Dewi Sartika,Warga bernama Sri mengatakan dia berniat memyaksikan peresmian underpass Dewi Sartika karena ingin bertemu dengan Gubernur Jawa Barat Ridwan Kamil (RK).
"Akses ke Masjid Al Jabbar Macet Panjang, Ini Tips dari Ridwan Kamil","Akses jalan menuju Masjid Al Jabbar, Bandung, kerap mengalami kemacetan panjang. Gubernur Jawa Barat Ridwan Kamil bicara soal jalan keluar kemacetan tersebut."
Pesan Ridwan Kamil ke bank bjb buat Hadapi 2023: Gesit Beradaptasi!,Gubernur Jawa Barat Ridwan Kamil memberi pesan untuk bank bjb agar bisa melalui tantangan yang ada di tahun 2023
NasDem Tak Merasa Disindir Jokowi soal Grasa-grusu Usung Capres,Partai NasDem tak merasa pidato Presiden Jokowi di HUT PDIP soal 'grasa-grusu usung capres' ditujukan kepada pihaknya.
Jembatan Cimandur Lebak yang Putus Diterjang Banjir Dibangun Kembali,"Jembatan Cimandur di Kecamatan Bayah, Lebak, Banten, yang putus diterjang banjir sedang proses pembangunan. Jembatan itu sudah hampir selesai dibangun."
99 Lampu Gentur di Masjid Al Jabbar Ternyata dari Cianjur,"99 lampu hiasan interior di Masjid Al Jabbar, Kota Bandung yang fenomenal ternyata berasal dari Kampung Gentur Cianjur."
"Gelora Sindir Capres Tak Punya Partai, NasDem Bilang Anies Penuhi Syarat","""Anies sudah dicalonkan oleh Nasdem yang memiliki keterwakilan 10% di parlemen. Dan akan segera digenapkan setelah PD dan PKS bergabung,"" kata Hermawi Taslim."
Sejarawan: Pembangunan Pangandaran Jangan Sembrono,Sejarawan Ari Nugroho mewanti-wanti agar pembangunan Pangandaran tak melupakan faktor historis dan geologis.
"Hadiri Harlah ke-50 PPP di Sumedang, Mardiono: PPP Alami Kematangan",Plt Ketua Umum Partai Persatuan Pembangunan (PPP) Muhamad Mardiono menghadiri acara puncak peringatan Hari Lahir (Harlah) ke-50.
Jabar Sepekan: Model Amalia Tambunan Jadi Korban Begal Pantat,Beragam peristiwa terjadi di Jawa Barat sepanjang pekan ini. Mulai dari konten Masjid Al Jabbar yang mencapai Rp 15 M hingga kasus begal pantat di Bandung.
Spanduk Tolak Perpanjangan Jabatan Presiden Terpampang di Musra XIII Jatim,Sejumlah spanduk terpampang di lokasi Musra XIII Jatim di Surabaya. Spanduk itu berisi pesan penolakan perpanjangan jabatan Presiden hingga penolakan 3 periode
Wagub Uu Ingin PPP Usung Ridwan Kamil Jadi Capres di Pemilu 2024,Wakil Gubernur Jawa Barat Uu Ruzhanul Ulum meminta Dewan Pimpinan Pusat (DPP) Partai Persatuan Pembangunan (PPP) mengusung Ridwan Kamil jadi Capres di 2024.
"Soal Maju ke Pilgub Jabar, Uu: Saya Tak Berani Lawan Pak Emil",Wakil Gubernur Jawa Barat (Jabar) Uu Ruzhanul Ulum mengaku siap mencalonkan diri menjadi Gubernur Jabar andai RK mau ke Pilpres 2024.
Heboh Tentara Amerika 'Serbu' Gerobak Baso Tahu di Bandung,Tentara Amerika Serikat (AS) dalam beberapa hari terakhir menjadi perbincangan warganet. Rupanya mereka doyan baso tahu Bandung!
"Gelora Dukung Anis Matta-Fahri Maju Pilpres 2024, Singgung Tiket Anies",Partai Gelora bakal mendorong Anis Matta dan Fahri Hamzah maju capres-cawapres 2024. Gelora menyinggung Anies Baswedan dan Ridwan Kamil yang tak punya partai.
Pekik 'RK Presiden' di Puncak Harlah ke-50 PPP,Gubernur Jawa Barat M Ridwan Kamil didukung jadi calon presiden oleh ribuan kader Partai Persatuan Pembangunan (PPP) Kabupaten Sumedang.
Kisah Perkawanan Yadi dan RK Kala Jaga Kelestarian Sungai Cikapundung,Sekjen Komisaris Sungai Jawa Barat Yadi Supriyadi pernah punya kisah perkawanan dengan Ridwan Kamil dalam merawat Sungai Cikapundung.
"RK Dikabarkan Sudah Gabung Golkar, Waketum: Kita Sih Welcome Banget",Beredar kabar Ridwan Kamil telah bergabung ke Partai Golkar melalui Kosgoro 1957. Apa kata Golkar?
Bagi-bagi Sepeda Mirip Jokowi dan Gimmick Politik Ridwan Kamil di Tasik,"Peresmian pembangunan objek wisata Situ Gede di Kota Tasikmalaya, oleh Gubernur Jabar Ridwan Kamil memberi kesan berbeda bagi masyarakat yang hadir."
Golkar: Keanggotaan Ridwan Kamil Tinggal Tunggu Legal-Formal,Politikus Golkar Nurul Arifin mengatakan masih akan menunggu legal formal RK menjadi anggota Partai pohon beringin tersebut. Golkar bakal menyambut baik RK.
"Kian Dekat Gabung Golkar, Ridwan Kamil: Sedang Disinkronisasi",Gubernur Jawa Barat Ridwan Kamil memberikan sinyal positif terkait pilihan partai politik yang akan dijadikan 'perahu' untuk mengarungi Pemilu 2024.
"Resmikan Alun-alun Singaparna, Ridwan Kamil Beri Pesan ke Warga Tasik","Gubernur Jabar Ridwan Kamil meresmikan Alun-alun Singaparna, Kabupaten Tasikmalaya. Dia meminta warga untuk menjaga ruang publik yang baru diresmikan itu."
Musra ke XIII Jawa Timur Munculkan 6 Sosok Terkuat Capres-Cawapres,Musyawarah Rakyat yang dimotori Relawan Buruh Sahabat Jokowi akan digelar di Surabaya pada 15 Januari. Ada 6 sosok terkuat capres-cawapres yang muncul.
Airlangga Bakal Umumkan Langsung Status RK saat Resmi Berseragam Golkar,Ridwan Kamil dikabarkan telah bergabung dengan Golkar. Ketum Golkar Airlangga Hartato disebut akan mengumumkannya secara langsung.
Saat Tentara Amerika Ketagihan Baso Tahu Bandung,Media sosial dikejutkan dengan foto-foto tentara Amerika Serikat yang antre di sebuah gerobak jajanan. Mereka diketahui sedang berada di Bandung.
"Tentara Amerika Jajan Batagor di Bandung, Ridwan Kamil Senang","Aksi para tentara Amerika Serikat jajan batagor dan siomai di wilayah Bandung, Jawa Barat, mengundang perhatian warganet. Gubernur Ridwan Kamil ikut bersuara."
Gokil! Tentara Amerika Jajan Bakso Tahu di Bandung,Aksi para tentara Amerika Serikat mengundang perhatian warganet. Pasalnya mereka terekam tengah memborong jajanan bakso tahu siomay di Bandung.
Ketua DPP Golkar: Ridwan Kamil Sudah Masuk ke Golkar Melalui Kosgoro,"Ketua DPP Partai Golkar Dave Laksono mengatakan Gubernur Jawa Barat, Ridwan Kamil, telah menjadi anggota Partai Golkar."
RK soal Emak-emak Joget di Masjid Al Jabbar: Hargai Tempat Ibadah,Sebuah potongan video sekelompok emak-emak berjoget di Masjid Al Jabbar viral di media sosial. Gubernur Ridwan Kamil menanggapi beredarnya video tersebut.
Respons RK soal Terhambatnya Pembuangan Sampah ke TPA Sarimukti,"Pembuangan sampah dari wilayah di Bandung Raya ke TPA Sarimukti, Kabupaten Bandung Barat (KBB) lagi-lagi terhambat. Ini respons Ridwan Kamil."
"Emak-emak Joget di Masjid Al Jabbar, RK: Tolong Hargai Tempat Ibadah",Sebuah potongan video yang menunjukan sekelompok emak-emak berjoget di Masjid Al Jabbar kini menjadi sorotan hingga menuai banyak kecaman. Ini respons RK.
Sudah Jodohkan Capres-cawapres di The Matchmaker? Cek Jagoanmu di Sini,Sudah ribuan detikers ikutan The Matchmaker dan ada sederet nama yang saat ini jadi favorit detikers untuk maju di Pilpres 2024. Ada jagoanmu? Cek di sini
Masjid Al Jabbar Perlu Didukung Sistem Pengelolaan Sampah,"Masjid Al Jabbar menjadi daya tarik wisata religi baru. Namun sayangnya berbagai persoalan muncul usai peresmian masjid, salah satunya sampah."
Jabar Hari Ini: Kebakaran Ludeskan RM Ampera di Bandung,"Beragam peristiwa terjadi di Jawa Barat (Jabar) hari ini, Kamis (12/1/2023). Mulai dari kebakaran RM Ampera di Bandung hingga polisi tangkap Kadal pembunuh."
Ridwan Kamil Serahkan Kebijakan Larangan Lato-lato ke Pemda,Gubernur Jawa Barat Ridwan Kamil merespons maraknya penggunaan lato-lato yang kini sedang digandrungi anak sekolah.
Survei Elektabilitas Capres di Surabaya: Ganjar Unggul Jauh di Atas Anies,"Dari survei SSC yang dilakukan di Surabaya, elektabilitas Ganjar Pranowo jauh di atas Aneis Baswedan. Apa faktornya?"
"Relawan Bocorkan Progres Komunikasi RK dengan Golkar, PAN dan Gerindra",Ridwan Kamil hingga kini belum memutuskan pilihan partai politik menjelang Pemilu 2024 mendatang. Ini kata relawan Ridwan Kamil.
Respons Ridwan Kamil soal Status Darurat Medis Chikbul di Jabar,"Gubernur Jabar Ridwan Kamil mengatakan, pihaknya akan merapatkan situasi darurat medis atas kasus chikbul. Status itu dikeluarkan usai 28 anak alami keracunan."
"RK soal Anggaran Rp 15 M Masjid Al Jabbar: Buat Konten Museum, Bukan Medsos",Gubernur Jawa Barat Ridwan Kamil akhirnya buka suara soal sorotan terhadap proyek konten Masjid Al Jabbar Rp 15 miliar.
Ridwan Kamil Jelaskan soal Konten Masjid Al Jabbar Rp 15 M,Gubernur Jawa Barat Ridwan Kamil akhirnya buka suara soal sorotan terhadap proyek konten Masjid Al Jabbar Rp 15 miliar.
Sekda Bandung Soroti soal Parkir Sembarangan-PKL di Masjid Al Jabbar,"Sekda Kota Bandung Ema Sumarna meninjau Masjid Raya Al Jabbar. Ia meninjau soal sarana dan prasarana, termasuk akses jalan dan lahan parkir di masjid."
Sembilan Matahari Buka Suara soal Konten Masjid Al Jabbar Rp 15 M,Masjid Al Jabbar sedang menjadi sorotan publik. gegara proyek dengan nama 'Pembuatan Konten Masjid Raya Provinsi Jawa Barat' yang mencapai belasan miliar.
Ridwan Kamil Bakal Resmikan Underpass Dewi Sartika Depok 17 Januari,"Proyek underpass di Jalan Dewi Sartika, Kota Depok, telah selesai dikerjakan. Underpass itu akan diresmikan Gubernur Jawa Barat Ridwan Kamil pada 17 Januari."
Wagub Uu Sebut Alun-alun Singaparna Akan Diresmikan RK 14 Januari,"Singaparna sebagai Ibu Kota Kabupaten Tasikmalaya, Jawa Barat terus bersolek. Kini, Singaparna memiliki alun-alun yang bisa dijadikan ikon kota."
Wow! Anggaran Pembuatan Konten Masjid Al Jabbar Capai Rp 15 M,"Sorotan terhadap Masjid Al Jabbar rupanya belum usai. Setelah sengkarut masalah sampah dan kemacetan, kini anggaran konten Rp 15 miliar menjadi sorotan."
Ortu Ancam Gugat Walkot Depok ke PTUN Jika Tetap Gusur SDN Pocin 1,"Kuasa hukum wali murid SDN Pocin 1, Francine Widjojo, mengatakan akan menggugat Walkot Depok ke PTUN apabila tidak menggubris surat keberatan dalam 10 hari."
Lengan Arsy Hermansyah Sampai Lebam karena Lato-lato,Arsy Hermansyah sampai lebam saking antusiasnya main lato-lato. Atta Halilintar sarankan main lato-lato 'matic' tanpa tali.
Aksi Bapak-bapak Gowes Bersihkan Sampah di Masjid Al Jabbar,Sekelompok bapak-bapak yang tergabung dalam Cipamokolan Onthel Komunitas (Onthel) tergerak untuk membersihkan sampah di Masjid Al Jabbar Bandung.
"Pernah Bikin Heboh, Kilauan NFT Memudar di 2022",NFT pernah menghebohkan Indonesia dengan munculnya seorang anak muda yang viral menjual hasil foto dirinya. Tapi kilauan NFT terus memudar sepanjang 2022.
Penataan Pura Besakih yang Dibandingkan Masjid Al Jabbar oleh Ridwan Kamil,Gubernur Jabar Ridwan Kamil membandingkan pembangunan Masjid Al Jabbar dengan penataan Pura Agung Besakih. Menurutnya keduanya sama karena menggunakan APBD.
Siapa yang Kembali Populerkan Lato-lato hingga Viral?,Lato-lato pernah populer di era yang berbeda. Lantas siapa yang kembali mempopulerkannya saat ini hingga viral di media sosial?
Segudang Pekerjaan Rumah di Balik Megahnya Masjid Al Jabbar,Di balik peresmian meriah Masjid Al Jabbar ternyata masih ada sederet pekerjaan rumah yang harus dibereskan.
Wisatawan Berpikap Serbu Masjid Al Jabbar Bandung,"Masjid Raya Al-Jabbar Provinsi Jawa Barat yang berada di Gedebage, Kota Bandung, menjadi destinasi wisata religi baru yang ada di Jabar."
Populer: Keluhan Angkutan Umum Bandung Vs Masjid Al Jabbar,"Keluhan buruknya angkutan umum di Jawa Barat, khususnya Bandung muncul di Twitter. Belakangan, makin panas gegara akses ke Masjid Raya Al Jabbar yang buruk."
Peziarah Berpikap Serbu Masjid Al Jabbar Bandung,"Warga berduyun-duyun mendatangi Masjid Al-Jabbar, Kota Bandung. Bahkan ada peziarah yang berpikap."
"Ridwan Kamil, Dengarkan Betapa Jengkelnya Warga soal Transportasi Publik Bandung",Transportasi publik di Bandung sedang disorot. Gubernur Jawa Barat Ridwan Kamil diminta untuk mau mendengarkan keluh kesah warganya.
Tentang Pura Besakih yang Dibanding-bandingkan oleh Ridwan Kamil,Pura Besakih muncul dalam cuitan Gubernur Jawa Barat Ridwan Kamil ketika menjawab soal dana pembangunan Masjid Al Jabbar.
"Wagub Ijeck Bagikan Momen Main Latto-latto, Siap Tantang Lord Arnold","Wagub Sumut Musa Rajekshah (Ijeck) bermain latto-latto. Dalam unggahannya di Instagram, Ijeck bertanya apakah permainannya sudah setara dengan Lord Arnold."
Ridwan Kamil Ungkap Mata Air Muncul di Dekat Makam Eril,Ridwan Kamil mengungkap mata air muncul di dekat makam anaknya Emmeril Kahn Mumtadz atau Eril. Mata air ini akan digunakan untuk masyarakat sekitar makam Eril.
Muncul Mata Air di Dekat Makam Eril,"Sebuah mata air ditemukan di dekat makam anak Ridwan Kamil, Emmeril Kahn Mumtadz. Mata air ini akan digunakan untuk kepentingan masyarakat sekitar makam Eril."
"Ramai Bahas-bahas Transportasi Publik di Bandung, Indonesia Peringkat Berapa di Dunia?",Sedang ramai di jagat maya kritikan terhadap Ridwan Kamil terkait transportasi publik. Urutan berpaakah posisi kualitas transportasi publik di Indonesia?
"Angkutan Umum Bandung Kerap Dikeluhkan, Makin Panas gegara Masjid Al Jabbar","Keluhan buruknya angkutan umum di Bandung sering muncul di Twitter. Belakangan, makin panas gegara akses ke Masjid Raya Al Jabbar yang buruk."
Langkah Golkar untuk Sambut Ridwan Kamil,Wakil Ketua DPD Partai Golkar Jawa Barat Aria Girinaya membantah Ridwan Kamil batal bergabung dengan Partai Golkar.
Jabar Hari Ini: Terungkap Aksi Pria Bandung Rekam-Jual Video Intip CD,Kasus perekaman video intip celana dalam (CD) di Bandung terungkap. Kasus tersebut merupakan salah satu dari sekian kabar hangat yang terjadi di Jawa Barat.
"Ridwan Kamil Disorot Bangun Masjid Pakai APBD, Proyek Lain Apa Kabar?",Gubernur Jawa Barat Ridwan Kamil masih menjadi trending topik di media sosial Twitter.
"Transportasi Publik Jadi Sorotan Netizen, Ridwan Kamil Bilang Begini",Transportasi publik di Jawa Barat menjadi sorotan netizen saat berdebat tentang pembangunan Masjid Al Jabbar. Begini respons Ridwan Kamil.
"Ada Duet Baru Muncul di Top 5 Capres-cawapres Favorit The Matchmaker, Siapa?",Ada pasangan capres-cawapres favorit baru detikers yang muncul di hasil sementara The Matchmaker. Siapa duet ini?
Reaksi Ridwan Kamil Disorot Warganet soal Transportasi Publik,Gubernur Jabar Ridwan Kamil disorot warganet soal transportasi publik. Begini reaksi Ridwan Kamil usai disorot.
"Ridwan Kamil Sebut Netizen RI Terkasar, Ini Datanya","Gubernur Jawa Barat, Ridwan Kamil, mencuit tentang kasarnya sebagian netizen Indonesia. Memang pernah ada penelitian yang membahas soal itu."
Tawaran Golkar hingga Batalnya Ridwan Kamil Gabung Parpol di 2022,Ridwan Kamil batal mengumumkan partai politik pilihannya di akhir 2022 lalu. Golkar Jabar mengungkap telah memberi 2 kali kesempatan kepada Ridwan Kmail.
Fenomena Citayam Fashion Week yang Viral dan Memudar di 2022,Tahun 2022 juga dimeriahkan dengan fenomena Citayam Fashion Week (CFW). Fenomena ini sempat begitu populer hingga akhirnya memudar dengan sendirinya.
"Sekjen PAN Bela Ridwan Kamil: Masjid Diperhatikan, Program Lain Juga",Sekjen PAN Eddy Soeparno menilai Ridwan Kamil terbuka menerima masukan dari berbagai pihak dan selalu siap berdiskusi menyampaikan rasionalisasi.
Linimasa Wajah Masjid Al Jabbar Rancangan RK yang Disorot Netizen,"Masjid Al Jabbar mengubah wajah kawasan Cimincrang, yang awalnya kampung di tengah persawahan menjadi sasaran pelancong dari berbagai daerah."
RK Diminta Hati-hati Keluarkan Pernyataan soal Bantuan Rp 1 T ke NU,Polemik klaim bantuan dari Ridwan Kamil (RK) ke NU Jawa Barat sebesar Rp 1 triliun selama menjabat sebagai gubernur rupanya belum selesai mendapat sorotan.
Jabar Hari Ini: Geger Sejoli Mesum di Teras Cihampelas Bandung,"Aksi sejoli mesum di Teras Cihampelas, Kota Bandung, menjadi topik utama dalam rubrik Jawa Barat (Jabar) hari ini."
"Heboh Masjid Al Jabbar Dibangun Pakai APBD, Ridwan Kamil Dicolek",Penggunaan anggaran pemerintah daerah untuk membangun tempat ibadah sebetulnya sah-sah saja. Bagaimana dengan Masjid Al Jabbar?
Infografis: 6 Secret of Happiness Ala Ridwan Kamil,Gubernur Jawa Barat Ridwan Kamil memberikan secuil rahasia kebahagiaan. Bisa diingat saat mulai lelah menjalani hidup dan butuh motivasi ya detikers...
Ridwan Kamil Diminta Tak Baper soal Kritikan tentang Masjid Al Jabbar,PKS Jawa Barat merespons adu argumen Ridwan Kamil (RK) dengan netizen soal Masjid Al Jabbar yang viral di media sosial.
Menelisik Penyebab Ridwan Kamil Batal Berseragam Partai di 2022,Guru besar ilmu politik Universitas Padjajaran (Unpad) Muradi turut menyoroti batalnya Gubernur Jawa Barat Ridwan Kamil (RK) berseragam partai di tahun 2022.
Survei Cawapres 2024 Indikator Politik: Ridwan Kamil Teratas,"Hasil sigi Indikator Politik menunjukkan elektabilitas Ridwan Kamil menang telak, disusul Sandiaga Uno dan Agus Harimurti Yudhoyono (AHY)."
"Siswa Dilarang Bawa Latto-latto ke Sekolah di Daerah Ini, Kenapa Ya?",Viralnya permainan latto-latto membuat Disdik Kabupaten Pesisir Barat keluarkan surat edaran ini. Apa isinya?
Berapa APBD Jabar yang Dipakai buat Bangun Masjid Al Jabbar?,Masjid Raya Al Jabbar belum henti-hentinya jadi bahan perbincangngan semenjak diresmikan.
